{
  "$schema": "https://json-schema.org/draft/2020-12/schema",
  "$id": "https://provider-screening.local/schemas/microsegmentation/assessment.schema.json",
  "title": "MicrosegmentationProductAssessment",
  "description": "Per-product evaluation against microsegmentation/checklist.yaml. Consumes the existing sources.jsonl and evidence.jsonl produced by the deep-research skill; every item verdict must link to evidence_ids drawn from that store.",
  "type": "object",
  "required": [
    "schema_version",
    "product_id",
    "vendor",
    "product_name",
    "checklist_version",
    "assessment_mode",
    "assessed_at",
    "items"
  ],
  "properties": {
    "schema_version": {
      "const": 1
    },
    "product_id": {
      "type": "string",
      "pattern": "^[a-z0-9][a-z0-9_-]*$",
      "description": "Stable slug used as the run directory name (e.g. 'illumio-core', 'akamai-guardicore')."
    },
    "vendor": { "type": "string", "minLength": 1 },
    "product_name": { "type": "string", "minLength": 1 },
    "product_version_reference": {
      "type": ["string", "null"],
      "description": "Version, release, or datasheet edition the assessment is anchored to. Null if unknown — do NOT invent.",
      "default": null
    },
    "checklist_version": {
      "type": "integer",
      "minimum": 1,
      "description": "Must equal meta.version in checklist.yaml at time of run."
    },
    "assessment_mode": {
      "type": "string",
      "enum": ["screen", "standard", "deep"],
      "description": "screen = only items with screen:true (quick gate); standard/deep = all items."
    },
    "research_run_id": {
      "type": ["string", "null"],
      "description": "Optional pointer to run_manifest.json id",
      "default": null
    },
    "assessed_at": {
      "type": "string",
      "format": "date-time"
    },
    "overall_notes": {
      "type": ["string", "null"],
      "description": "Optional 1-3 sentence overview. Do NOT restate item verdicts here.",
      "default": null
    },
    "items": {
      "type": "array",
      "minItems": 1,
      "items": { "$ref": "#/$defs/ItemAssessment" }
    },
    "gate_decision": {
      "type": "object",
      "required": ["recommendation", "rationale"],
      "properties": {
        "recommendation": {
          "type": "string",
          "enum": ["advance-to-deep", "drop", "needs-more-info"],
          "description": "Final recommendation used downstream. When it differs from default_recommendation the agent MUST fill override_reason (validator enforces)."
        },
        "rationale": {
          "type": "string",
          "minLength": 1,
          "maxLength": 800,
          "description": "≤ 3 sentences citing item IDs and evidence for the chosen recommendation."
        },
        "default_recommendation": {
          "type": ["string", "null"],
          "enum": ["advance-to-deep", "drop", "needs-more-info", null],
          "description": "Rule-based default computed from item verdicts. If agent fills it, validator checks the value matches its own computation.",
          "default": null
        },
        "override_reason": {
          "type": ["string", "null"],
          "maxLength": 800,
          "description": "REQUIRED (non-empty) when recommendation != default_recommendation. Explains why the model diverged from the rule.",
          "default": null
        }
      },
      "additionalProperties": false,
      "description": "Screen-mode only: required by validator when assessment_mode='screen'. Ignored for standard/deep."
    }
  },
  "additionalProperties": false,

  "$defs": {
    "ItemAssessment": {
      "type": "object",
      "required": ["item_id", "verdict", "confidence", "evidence_ids", "cited_source_ids", "source_types"],
      "properties": {
        "item_id": {
          "type": "string",
          "pattern": "^[0-9]+\\.[0-9]+[a-z]?$",
          "description": "Matches items[].id in checklist.yaml."
        },
        "verdict": {
          "type": "string",
          "enum": ["supported", "partial", "not_supported", "unknown", "not_applicable"],
          "description": "'unknown' is REQUIRED when no evidence was found; never invent 'not_supported' from absence."
        },
        "confidence": {
          "type": "string",
          "enum": ["high", "medium", "low"],
          "description": "Capped at 'medium' if source_types contains only 'vendor_doc' (enforced by validator)."
        },
        "numeric_value": {
          "type": ["number", "null"],
          "description": "REQUIRED for items with verdict_type=numeric_threshold when verdict is supported/not_supported. For verdict=partial may be null if notes explain the qualitative/imprecise evidence (e.g. vendor says 'single-digit percent').",
          "default": null
        },
        "unit": {
          "type": ["string", "null"],
          "description": "Must match the checklist item's threshold.unit when numeric_value is set.",
          "default": null
        },
        "evidence_ids": {
          "type": "array",
          "items": { "type": "string", "pattern": "^[0-9a-f]{16}$" },
          "description": "Pointers into evidence.jsonl. MUST be non-empty when verdict != unknown."
        },
        "cited_source_ids": {
          "type": "array",
          "items": { "type": "string", "pattern": "^[0-9a-f]{16}$" },
          "description": "Pointers into sources.jsonl. MUST be non-empty when verdict != unknown."
        },
        "source_types": {
          "type": "array",
          "uniqueItems": true,
          "items": {
            "type": "string",
            "enum": [
              "vendor_doc",
              "vendor_datasheet",
              "vendor_blog",
              "analyst_report",
              "third_party_review",
              "peer_reviewed",
              "regulatory_filing",
              "certification_registry",
              "community",
              "case_study",
              "conference_talk",
              "product_release_notes"
            ]
          },
          "description": "Distinct source categories represented in cited_source_ids. Used by validator to cap confidence."
        },
        "notes": {
          "type": ["string", "null"],
          "description": "≤ 2 sentences, MUST be a paraphrase of cited evidence. No speculation, no comparison to other products.",
          "maxLength": 500,
          "default": null
        },
        "gaps": {
          "type": ["string", "null"],
          "description": "Optional: what specifically is missing or unclear in the evidence for this item.",
          "maxLength": 500,
          "default": null
        }
      },
      "additionalProperties": false
    }
  }
}
