{
  "schema_version": 1,
  "product_id": "akamai-guardicore-segmentation",
  "vendor": "Akamai Technologies (Guardicore)",
  "product_name": "Akamai Guardicore Segmentation",
  "product_version_reference": "Centra/Guardicore Segmentation platform, current product line (v49-v54); staged docs span Centra 5.0 through 2026 product materials",
  "checklist_version": 1,
  "assessment_mode": "standard",
  "research_run_id": "run-akamai-guardicore-segmentation-standard-20260810",
  "assessed_at": "2026-08-10T07:42:31Z",
  "overall_notes": "Akamai Guardicore Segmentation is an agent-based (with agentless options) microsegmentation platform for hybrid cloud, DC, Kubernetes and OT. Core visibility, label-based policy, process-level enforcement, deception, HA/DR and full REST API are well documented; numeric agent-resource and latency thresholds are not met or not quantified in available sources.",
  "items": [
    {
      "item_id": "1.1",
      "verdict": "supported",
      "confidence": "high",
      "numeric_value": null,
      "unit": null,
      "evidence_ids": [
        "078cbadf4ac25af3",
        "4b20e4f5eef61978",
        "4b867de07a25c0f4",
        "bcbefdfe7d2a1320",
        "d0da504a11044331"
      ],
      "cited_source_ids": [
        "44c22a65e0af9c25",
        "557832137a7d2040",
        "7a0405f49fc96f97",
        "d2fbb7fe2d593a46",
        "fe14a292d15d5461"
      ],
      "source_types": [
        "community",
        "third_party_review",
        "vendor_datasheet",
        "vendor_doc"
      ],
      "notes": "The product auto-discovers assets and communication flows in real time across on-prem, cloud, Kubernetes and OT workloads; the Akamai product page, the Centra datasheet and the product brief all document continuous discovery, corroborated by PeerSpot user reviews and an independent technical blog.",
      "gaps": null
    },
    {
      "item_id": "1.2",
      "verdict": "supported",
      "confidence": "high",
      "numeric_value": null,
      "unit": null,
      "evidence_ids": [
        "04dd933d74d891c7",
        "1fc9f6f930b61fc5",
        "5a248e468332fec6",
        "9fcf55c67045947f"
      ],
      "cited_source_ids": [
        "425499d5039f6542",
        "44c22a65e0af9c25",
        "d2fbb7fe2d593a46",
        "fe14a292d15d5461"
      ],
      "source_types": [
        "community",
        "vendor_datasheet",
        "vendor_doc"
      ],
      "notes": "A single interactive Reveal map visualizes all assets, flows and dependencies with process-level granularity, and label hierarchies (Environment/Application/Role) render as nested groups; corroborated by the user guide, datasheet and peer reviews.",
      "gaps": null
    },
    {
      "item_id": "1.3",
      "verdict": "partial",
      "confidence": "medium",
      "numeric_value": 30,
      "unit": "days",
      "evidence_ids": [
        "0aa905fadd6a8843",
        "87e6f9f834c35289",
        "8ebf880cfc9d0ebc",
        "e0a3252b1046f0bd"
      ],
      "cited_source_ids": [
        "21ad81ad0bb27fec"
      ],
      "source_types": [
        "vendor_doc"
      ],
      "notes": "Raw connection-flow retention in the management Elasticsearch defaults to 30 days (connections_delete_after_days) while daily grouped connections default to 90 days; both are configurable via CLI (gc-mgmtctl elastic_archive), so the 90-day requirement is met by default only for aggregated data or with custom retention settings.",
      "gaps": "No staged source states a single default retention period of 90 days or more for raw per-flow history."
    },
    {
      "item_id": "1.4",
      "verdict": "partial",
      "confidence": "medium",
      "numeric_value": null,
      "unit": null,
      "evidence_ids": [
        "124e203b038e30d0",
        "87214ce9e202115b"
      ],
      "cited_source_ids": [
        "425499d5039f6542",
        "d2fbb7fe2d593a46"
      ],
      "source_types": [
        "community",
        "vendor_doc"
      ],
      "notes": "Vulnerability data is collected via osquery-based Insight queries and a PeerSpot user describes Tenable integration that surfaces assets with highly exploitable vulnerabilities for policy building, but a dedicated CVE overlay rendered directly on the connectivity map is not explicitly documented in staged sources.",
      "gaps": null
    },
    {
      "item_id": "1.5",
      "verdict": "supported",
      "confidence": "medium",
      "numeric_value": null,
      "unit": null,
      "evidence_ids": [
        "e7118f805cd9ce66",
        "f8690a1444391a4e",
        "fe482223f2429c71"
      ],
      "cited_source_ids": [
        "44c22a65e0af9c25",
        "792beeaeb4ca23b4",
        "fe14a292d15d5461"
      ],
      "source_types": [
        "vendor_datasheet",
        "vendor_doc"
      ],
      "notes": "The Network Log surfaces security violations with filters and rule suggestions, the datasheet documents policy-based detection of unsanctioned activity plus reputation analysis of suspicious domains/IPs/hashes, and the product page highlights identification of known, unknown and unmanaged assets.",
      "gaps": null
    },
    {
      "item_id": "2.1",
      "verdict": "supported",
      "confidence": "high",
      "numeric_value": null,
      "unit": null,
      "evidence_ids": [
        "30a34377c4615b9b",
        "9f23bb6ab2b87c47",
        "bd562a8aa99bd575",
        "e4fbe3c792bf6ad8"
      ],
      "cited_source_ids": [
        "44c22a65e0af9c25",
        "792beeaeb4ca23b4",
        "d2fbb7fe2d593a46",
        "fe14a292d15d5461"
      ],
      "source_types": [
        "community",
        "vendor_datasheet",
        "vendor_doc"
      ],
      "notes": "Policies are built from labels (application/environment/role) and are decoupled from the underlying infrastructure; vendor documentation, the Centra datasheet and peer reviews all describe label-based, IP-independent policy creation.",
      "gaps": null
    },
    {
      "item_id": "2.2",
      "verdict": "supported",
      "confidence": "medium",
      "numeric_value": null,
      "unit": null,
      "evidence_ids": [
        "2cecd16584fd1074",
        "ac142a72a9c7229f",
        "bc8dbdff026c1123"
      ],
      "cited_source_ids": [
        "792beeaeb4ca23b4",
        "fe14a292d15d5461"
      ],
      "source_types": [
        "vendor_doc"
      ],
      "notes": "Centra's AI-powered engine auto-generates policy rules from templates and observed traffic, and the product page documents machine-learning-based policy recommendations; a PeerSpot reviewer notes that more AI automation for policy creation would still be welcome, so the feature is confirmed by vendor sources only.",
      "gaps": null
    },
    {
      "item_id": "2.3",
      "verdict": "supported",
      "confidence": "medium",
      "numeric_value": null,
      "unit": null,
      "evidence_ids": [
        "16e8ce6afa99b654",
        "56e4434fe30c103e",
        "5754bd187d332534",
        "a9766e397e060f92"
      ],
      "cited_source_ids": [
        "557832137a7d2040",
        "7a0405f49fc96f97",
        "995557ab55caa446",
        "fe14a292d15d5461"
      ],
      "source_types": [
        "third_party_review",
        "vendor_doc"
      ],
      "notes": "The product page states that security teams can simulate the impact of policies before they go live, the product brief documents staged draft/alert/block workflows with readiness measurement, and an independent blog describes Allow Mode simulation before any traffic is blocked.",
      "gaps": null
    },
    {
      "item_id": "2.4",
      "verdict": "supported",
      "confidence": "medium",
      "numeric_value": null,
      "unit": null,
      "evidence_ids": [
        "071c3a80a19d5c98"
      ],
      "cited_source_ids": [
        "425499d5039f6542"
      ],
      "source_types": [
        "vendor_doc"
      ],
      "notes": "The user guide documents a Revisions screen that saves every policy change indefinitely and allows reverting to a previous revision at any time, providing one-click rollback of published policies.",
      "gaps": null
    },
    {
      "item_id": "2.5",
      "verdict": "partial",
      "confidence": "medium",
      "numeric_value": null,
      "unit": null,
      "evidence_ids": [
        "097a4e89e09ea6fa",
        "d17f5112524e2857",
        "e701487ba9245889",
        "e7e43da86287ed3a"
      ],
      "cited_source_ids": [
        "2ac67dfe79f3424b",
        "425499d5039f6542",
        "44c22a65e0af9c25"
      ],
      "source_types": [
        "vendor_datasheet",
        "vendor_doc"
      ],
      "notes": "Label keys form a configurable hierarchy (e.g., Environment/Application/Role) that nests assets in the map, and policy rules support priority tiers (implied, override and standard rules), but explicit rule inheritance down a label hierarchy is not documented in staged sources.",
      "gaps": null
    },
    {
      "item_id": "3.1",
      "verdict": "supported",
      "confidence": "medium",
      "numeric_value": null,
      "unit": null,
      "evidence_ids": [
        "0c23beeaed60cfac",
        "14957d615f877c31",
        "17d7cf97a488bcc4",
        "5d25a6dc1149aea6"
      ],
      "cited_source_ids": [
        "21ad81ad0bb27fec",
        "557832137a7d2040",
        "90fdd12b84e1e554"
      ],
      "source_types": [
        "third_party_review",
        "vendor_doc"
      ],
      "notes": "Vendor documentation states agents run on all Windows and Linux operating systems, new and legacy, with OS tables covering Windows Server 2003-2019, RHEL/CentOS/Ubuntu/Debian/SUSE, AIX 6.1/7.1/7.2 and Solaris 10/11; an independent blog corroborates Windows Server 2012+, major Linux distributions and Unix variants including AIX and Solaris.",
      "gaps": "In the older Centra 5.0 admin guide, enforcement on AIX/Solaris is documented at network (L4) level and HP-UX is Reveal-only."
    },
    {
      "item_id": "3.2",
      "verdict": "supported",
      "confidence": "medium",